NO;DIMENSI;SUB DIMENSI;INDIKATOR;ITEM;SKOR Rata-Rata;SKOR 1;SKOR 2;SKOR 3;SKOR 4;SKOR 5;INTERVENSI KEGIATAN;PELAKSANA KEGIATAN PUSAT;PELAKSANA KEGIATAN PROVINSI;PELAKSANA KEGIATAN KABUPATEN;PELAKSANA KEGIATAN DESA;PELAKSANA KEGIATAN Lainnya
1;LAYANAN DASAR;SUB-DIMENSI PENDIDIKAN;AKSES TERHADAP PAUD/TK/Sederajat;Keberadaan PAUD/TK/Sederajat di Desa;;;;;;;;Kemendikbud, Kemendagri, Kementerian PUPR;Dinas PMD, Dinas Dikbud, Dinas PUPR;Dinas Dikbud, Dinas PMD, Dinas PUPR;Desa;Swasta
1;LAYANAN DASAR;SUB-DIMENSI PENDIDIKAN;AKSES TERHADAP PAUD/TK/Sederajat;Kemudahan Akses menuju PAUD/TK/Sederajat terdekat di Desa;;;;;;;;Kemendikbud, Kemendagri, Kementerian PUPR;Dinas PMD, Dinas Dikbud, Dinas PUPR;Dinas Dikbud, Dinas PMD, Dinas PUPR;Desa;Swasta
1;LAYANAN DASAR;SUB-DIMENSI PENDIDIKAN;AKSES TERHADAP PAUD/TK/Sederajat;Angka Partisipasi Murni (APM) anak usia 3 - 6 tahun yang bersekolah PAUD/TK/Sederajat di desa;;;;;;;;Kemendikbud, Kemendagri, Kementerian PUPR;Dinas PMD, Dinas Dikbud, Dinas PUPR;Dinas Dikbud, Dinas PMD, Dinas PUPR;Desa;Swasta
1;LAYANAN DASAR;SUB-DIMENSI PENDIDIKAN;AKSES TERHADAP SD/MI/Sederajat;Kemudahan Akses menuju SD/MI/Sederajat terdekat di Desa;;;;;;;;Kemendikbud, Kemendagri, Kementerian PUPR;Dinas PMD, Dinas Dikbud, Dinas PUPR;Dinas Dikbud, Dinas PMD, Dinas PUPR;Desa;Swasta
1;LAYANAN DASAR;SUB-DIMENSI PENDIDIKAN;AKSES TERHADAP SD/MI/Sederajat;Angka Partisipasi Murni (APM)  anak usia 7-12 tahun yang bersekolah SD/MI/Sederajat di desa;;;;;;;;Kemendikbud, Kemendagri, Kementerian PUPR;Dinas PMD, Dinas Dikbud, Dinas PUPR;Dinas Dikbud, Dinas PMD, Dinas PUPR;Desa;Swasta
1;LAYANAN DASAR;SUB-DIMENSI PENDIDIKAN;AKSES TERHADAP SMP/MTs/Sederajat;Kemudahan Akses menuju SMP/MTs/Sederajat terdekat di Desa;;;;;;;;Kemendikbud, Kemendagri, Kementerian PUPR;Dinas PMD, Dinas Dikbud, Dinas PUPR;Dinas PMD, Dinas PUPR;Desa;Swasta
1;LAYANAN DASAR;SUB-DIMENSI PENDIDIKAN;AKSES TERHADAP SMP/MTs/Sederajat;Angka Partisipasi Murni (APM)  anak usia 13-15 tahun yang bersekolah SMP/MTs/Sederajat di desa;;;;;;;;Kemendikbud, Kemendagri, Kementerian PUPR;Dinas PMD, Dinas Dikbud, Dinas PUPR;Dinas PMD, Dinas PUPR;Desa;Swasta
1;LAYANAN DASAR;SUB-DIMENSI PENDIDIKAN;AKSES TERHADAP SMA/SMK/MA/MAK/Sederajat;Kemudahan Akses menuju SMA/SMK/MA/MAK/Sederajat terdekat di Desa;;;;;;;;Kemendikbud, Kemendagri, Kementerian PUPR;Dinas PMD, Dinas Dikbud, Dinas PUPR;Dinas PMD, Dinas PUPR;Desa;Swasta
1;LAYANAN DASAR;SUB-DIMENSI PENDIDIKAN;AKSES TERHADAP SMA/SMK/MA/MAK/Sederajat;Angka Partisipasi Murni (APM)  anak usia 16-18 tahun yang bersekolah SMA/SMK/MA/MAK/Sederajat di desa;;;;;;;;Kemendikbud, Kemendagri, Kementerian PUPR;Dinas PMD, Dinas Dikbud, Dinas PUPR;Dinas PMD, Dinas PUPR;Desa;Swasta
1;LAYANAN DASAR;SUB-DIMENSI KESEHATAN;Layanan Sarana Kesehatan;Kemudahan akses menuju Sarana Kesehatan;;;;;;;;Kemenkes, Kemen PUPR;Dinas PUPR;Dinas Kesehatan, DPMD, Dinas PUPR;Desa;Swasta
1;LAYANAN DASAR;SUB-DIMENSI KESEHATAN;Fasilitas Puskesmas Pembantu (Pustu);Keberadaan Fasilitas Puskesmas Pembantu (Pustu) termasuk  Poskesdes/Polindes di Desa;;;;;;;;Kemenkes, Kemen PUPR;Dinas PUPR;Dinas Kesehatan, DPMD, Dinas PUPR;Desa;Swasta
1;LAYANAN DASAR;SUB-DIMENSI KESEHATAN;Fasilitas Puskesmas Pembantu (Pustu);Kemudahan akses menuju Fasilitas Puskesmas Pembantu (Pustu) termasuk Kesehatan Poskesdes/Polindes;;;;;;;;Kemenkes, Kemen PUPR;Dinas PUPR;Dinas Kesehatan, DPMD, Dinas PUPR;Desa;Swasta
1;LAYANAN DASAR;SUB-DIMENSI KESEHATAN;Aktivitas Posyandu;Ketersediaan Fasilitas Posyandu di Desa;;;;;;;;Kemenkes, Kemen PUPR;Dinas PUPR;Dinas Kesehatan, DPMD, Dinas PUPR;Desa;
1;LAYANAN DASAR;SUB-DIMENSI KESEHATAN;Aktivitas Posyandu;Keberadaan Aktivitas Posyandu;;;;;;;;Kemenkes, Kemen PUPR;Dinas PUPR;Dinas Kesehatan, DPMD, Dinas PUPR;Pemdes;Swasta
1;LAYANAN DASAR;SUB-DIMENSI KESEHATAN;Aktivitas Posyandu;Kemudahan akses menuju Fasilitas Posyandu;;;;;;;;Kemenkes, Kemen PUPR;Dinas PUPR;Dinas Kesehatan, DPMD, Dinas PUPR;Pemdes;Swasta
1;LAYANAN DASAR;SUB-DIMENSI KESEHATAN;Layanan Dokter;Ketersediaan layanan dokter di desa;;;;;;;;Kemenkes, Kemen PUPR;Dinas PUPR;Dinas Kesehatan, DPMD, Dinas PUPR;Pemdes;Swasta
1;LAYANAN DASAR;SUB-DIMENSI KESEHATAN;Layanan Dokter;Operasional ketersediaan layanan dokter di desa;;;;;;;;Kemenkes, Kemen PUPR;Dinas PUPR;Dinas Kesehatan, DPMD, Dinas PUPR;Pemdes;Swasta
1;LAYANAN DASAR;SUB-DIMENSI KESEHATAN;Layanan Dokter;Penyedia layanan dokter di desa;;;;;;;;Kemenkes, Kemen PUPR;Dinas PUPR;Dinas Kesehatan, DPMD, Dinas PUPR;Pemdes;Swasta
1;LAYANAN DASAR;SUB-DIMENSI KESEHATAN;Layanan Dokter;Keberadaan Penyedia Transportasi penunjang menuju layanan Dokter;;;;;;;;Kemenkes, Kemen PUPR;Dinas PUPR;Dinas Kesehatan, DPMD, Dinas PUPR;Pemdes;Swasta
1;LAYANAN DASAR;SUB-DIMENSI KESEHATAN;Layanan Bidan;Ketersediaan layanan Bidan di Desa;;;;;;;;Kemenkes, Kemen PUPR;Dinas PUPR;Dinas Kesehatan, DPMD, Dinas PUPR;Pemdes;Swasta
1;LAYANAN DASAR;SUB-DIMENSI KESEHATAN;Layanan Bidan;Operasional ketersediaan layanan Bidan di desa;;;;;;;;Kemenkes, Kemen PUPR;Dinas PUPR;Dinas Kesehatan, DPMD, Dinas PUPR;Pemdes;Swasta
1;LAYANAN DASAR;SUB-DIMENSI KESEHATAN;Layanan Bidan;Penyedia layanan Bidan di desa;;;;;;;;Kemenkes, Kemen PUPR;Dinas PUPR;Dinas Kesehatan, DPMD, Dinas PUPR;Pemdes;Swasta
1;LAYANAN DASAR;SUB-DIMENSI KESEHATAN;Layanan Bidan;Keberadaan Penyedia Transportasi penunjang menuju layanan Bidan;;;;;;;;Kemenkes, Kemen PUPR;Dinas PUPR;Dinas Kesehatan, DPMD, Dinas PUPR;Pemdes;Swasta
1;LAYANAN DASAR;SUB-DIMENSI KESEHATAN;Layanan Tenaga Kesehatan Lainnya;Ketersediaan layanan Tenaga Kesehatan di Desa;;;;;;;;Kemenkes, Kemen PUPR;Dinas PUPR;Dinas Kesehatan, DPMD, Dinas PUPR;Pemdes;Swasta
1;LAYANAN DASAR;SUB-DIMENSI KESEHATAN;Layanan Tenaga Kesehatan Lainnya;Operasional ketersediaan layanan Tenaga Kesehatan di desa;;;;;;;;Kemenkes, Kemen PUPR;Dinas PUPR;Dinas Kesehatan, DPMD, Dinas PUPR;Pemdes;Swasta
1;LAYANAN DASAR;SUB-DIMENSI KESEHATAN;Layanan Tenaga Kesehatan Lainnya;Penyedia layanan Tenaga Kesehatan di desa;;;;;;;;Kemenkes, Kemen PUPR;Dinas PUPR;Dinas Kesehatan, DPMD, Dinas PUPR;Pemdes;Swasta
1;LAYANAN DASAR;SUB-DIMENSI KESEHATAN;Layanan Tenaga Kesehatan Lainnya;Keberadaan Penyedia Transportasi penunjang menuju layanan Nakes;;;;;;;;Kemenkes, Kemen PUPR;Dinas PUPR;Dinas Kesehatan, DPMD, Dinas PUPR;Pemdes;Swasta
1;LAYANAN DASAR;SUB-DIMENSI KESEHATAN;Jaminan Kesehatan Nasional;Persentase keanggotaan BPJS;;;;;;;;Kemenkes, Kemen PUPR;Dinas PUPR;Dinas Kesehatan, DPMD, Dinas PUPR;Pemdes;Swasta
1;LAYANAN DASAR;SUB-DIMENSI KESEHATAN;Jaminan Kesehatan Nasional;Keberadaan kegiatan sosialisasi dan/atau advokasi terkait program jaminan kesehatan nasional di desa;;;;;;;;Kemenkes, Kemen PUPR;Dinas PUPR;Dinas Kesehatan, DPMD, Dinas PUPR;Pemdes;Swasta
1;LAYANAN DASAR;Sub-Dimensi Utilitas Dasar;Rumah Tangga dengan Air Minum Aman;Operasional Ketersediaan Air Minum di Desa dalam seminggu;;;;;;;;PAMSIMAS, PU;Dinas PUPR;Dinas PUPR, Dinas Kesehatan, DPMD, PDAM;Pemdes;Swasta
1;LAYANAN DASAR;Sub-Dimensi Utilitas Dasar;Rumah Tangga dengan Air Minum Aman;Ketersediaan Air Minum untuk warga desa;;;;;;;;PAMSIMAS, PU;Dinas PUPR;Dinas PUPR, Dinas Kesehatan, DPMD, PDAM;Pemdes;Swasta
1;LAYANAN DASAR;Sub-Dimensi Utilitas Dasar;Rumah Tangga dengan Air Minum Aman;Kemudahan akses Air Minum untuk warga di desa;;;;;;;;PAMSIMAS, PU;Dinas PUPR;Dinas PUPR, Dinas Kesehatan, DPMD, PDAM;Pemdes;Swasta
1;LAYANAN DASAR;Sub-Dimensi Utilitas Dasar;Rumah Tangga dengan Air Minum Aman;Kualitas Air Minum di Desa (Tidak untuk Berbau, Berwarna, & Berasa);;;;;;;;PAMSIMAS, PU;Dinas PUPR;Dinas PUPR, Dinas Kesehatan, DPMD, PDAM;Pemdes;Swasta
1;LAYANAN DASAR;Sub-Dimensi Utilitas Dasar;Persentase Rumah Tidak Layak Huni;Persentase Rumah Tidak Layak Huni;;;;;;;;PAMSIMAS, PU;Dinas PUPR;Dinas PUPR, Dinas Kesehatan, DPMD, PDAM;Pemdes;Swasta
2;SOSIAL;SUB-DIMENSI AKTIVITAS;Kearifan Sosial/Budaya dan Keagamaan;Keberadaan kearifan budaya/sosial/keagamaan yang ada/menjadi ciri khas desa;;;;;;;;Kemendesa PDT, Kemendikbudristek, Kemenag, Kemenparekraf;Dinas PMD, Dians Pariwisata;Dinas PMD, Dinas Pariwisata;Pemdes, Lembaga Adat, Karang Taruna;Swasta
2;SOSIAL;SUB-DIMENSI AKTIVITAS;Kearifan Sosial/Budaya dan Keagamaan;Jumlah Kearifan budaya/sosial yang masih dipertahankan/dilestarikan;;;;;;;;Kemendesa PDT, Kemendikbudristek, Kemenag, Kemenparekraf;Dinas PMD, Dians Pariwisata, Dinas Pendidikan dan Kebudayaan;Dinas PMD, Dians Pariwisata, Dinas Pendidikan dan Kebudayaan;Pemdes, Lembaga Adat, Kelompok Seni, Karang Taruna;Swasta
2;SOSIAL;SUB-DIMENSI AKTIVITAS;Frekuensi Gotong Royong;Keberadaan kegiatan gotong royong di Desa;;;;;;;;Kemendagri, Kemendesa PDT, Kemensos;Dinas PMD, Dinas Sosial;Dinas PMD, Dinas Sosial;Lembaga Kemasyarakatan Desa (LPMD/RT/RW), Pemdes, Karang Taruna;Swasta
2;SOSIAL;SUB-DIMENSI AKTIVITAS;Frekuensi Gotong Royong;Frekuensi Kegiatan Gotong Royong di desa;;;;;;;;Kemendagri, Kemendesa PDT, Kemensos;Dinas PMD, Dinas Sosial;Dinas PMD, Dinas Sosial;Lembaga Kemasyarakatan Desa (LPMD/RT/RW), Pemdes, Karang Taruna, Kelompok Pemuda;Swasta
2;SOSIAL;SUB-DIMENSI AKTIVITAS;Frekuensi Gotong Royong;Keterlibatan warga dalam kegiatan gotong royong;;;;;;;;Kemendagri, Kemendesa PDT, Kemensos;Dinas PMD, Dinas Sosial;Dinas PMD, Dinas Sosial;Lembaga Kemasyarakatan Desa (LPMD/RT/RW), Pemdes, Karang Taruna, Kelompok Pemuda;Swasta
2;SOSIAL;SUB-DIMENSI AKTIVITAS;Kegiatan Olahraga;Frekuensi Aktivitas Kegiatan Olahraga dilakukan dalam satu bulan;;;;;;;;Kemenpora, Kemendesa,Koni, Lembaga Olah Raga nasional;Dispora, Dinkes;Dispora, Dinkes;Pemdes, karang Taruna, PKK;Klub Olahraga,Pusat Studi Olah Raga, kampus
2;SOSIAL;SUB-DIMENSI AKTIVITAS;Mitigasi dan Penanganan Konflik Sosial;Penyelesaian Konflik secara damai;;;;;;;;Kemendagri, kemenkum dan HAM, kemenkopolhukam, BIN, Kepolisian, TNI;Kesbangpol,Dinas Kominfo, Dinas Sosial;Kesbangpol,Dinas Kominfo, Dinas Kesejahteraan Sosial, Dinas PMD;Lembaga Kemasyarakatan Desa (LPMD/RT/RW), Pemdes, Karang Taruna, Kelompok Pemuda, Tokoh Masyarakat dan Adat;Fasilitator Mediasi Akademis, Kampus
2;SOSIAL;SUB-DIMENSI AKTIVITAS;Mitigasi dan Penanganan Konflik Sosial;Peranan aparat keamanan menjadi mediator / penengah dalam penyelesaian Konflik;;;;;;;;Kemenko Polhukam, Kemendagri, Kemenhan, Polri, TNI;Satpol PP,Dinsos, Forkopinda;Satpol PP,Dinsos, Forkopinda;pemdes, LKS, Lembaga Mediasi Swasta;Akademisi, Pakar Konsflik dan Perdamaian
2;SOSIAL;SUB-DIMENSI AKTIVITAS;Mitigasi dan Penanganan Konflik Sosial;Peranan aparat pemerintah menjadi mediator / penengah dalam penyelesaian Konflik;;;;;;;;Kemendagri, Kemendesa PDTT, Kemenko Polhukam, Kemenkumham, BNPB, Lemhannas, BPN;Kesbangpol, Dinas PMD;Kesbangpol, Dinas PMD, Dinsos;Pemdes, BPD;LSM, Akademisi, Pusat Studi konflik
2;SOSIAL;SUB-DIMENSI AKTIVITAS;Mitigasi dan Penanganan Konflik Sosial;Peranan tokoh masyarakat menjadi mediator / penengah dalam penyelesaian Konflik;;;;;;;;Kemendagri, Kemendesa PDTT,Kemenag, Kemenko PMK, BNPT, LIPI, MUI;Dinas PMD, Dinas Pariwisata, Kesbangpol;Dinas PMD, Dinsos, Dinas pendidikan;Pemdes, BPD;LSM, Akademisi, Pusat Kajian Konflik dan Perdamaian
2;SOSIAL;SUB-DIMENSI AKTIVITAS;Mitigasi dan Penanganan Konflik Sosial;Peranan tokoh agama menjadi mediator / penengah dalam penyelesaian Konflik;;;;;;;;Kemenag, Kemenko PMK, Kemendagri, MUI, Konferensi Waligereja Indonesia, BNPT;Kesbangpol, Dinsos, Dinas PMD,;Kesbangpol, Dinsos, Dinas PMD, Dias Dikbud;Pemdes, BPD, ;LSM Keagamaan, Swasta, Akademisi, Pusat Studi Agama dan Perdamaian
2;SOSIAL;SUB-DIMENSI AKTIVITAS;Satkamling;Keberadaan Satuan Keamanan Lingkungan (Satkamling) di Desa;;;;;;;;Kemendagri, Kemenko Polhukam, Kemendesa PDTT, Polri, BNPT,BIN;Kesbangpol, Dinas PMD,Forkopinda;Kesbangpol, Dinas PMD,Forkopinda;Pemdes, BPD, RT/RW;Akademisi, Pusat Studi Keamanan
2;SOSIAL;SUB-DIMENSI AKTIVITAS;Satkamling;Aktivitas Satuan Keamanan Lingkungan (Satkamling) di Desa;;;;;;;;Kemendagri, Kemendesa PDTT, Kemenko Polhukam, Polri, TNI, BNPT, BIN;Kesbangpol, Dinas PMD;Kesbangpol, Dinas PMD;Pemdes, BPD, RT/RW, Tokoh Masyarakat;Akademisi, Pusat Studi Keamanan
2;SOSIAL;SUB-DIMENSI FASILITAS MASYARAKAT;Taman Bacaan Masyarakat/ Perpustakaan Desa;Keberadaan Taman Bacaan Masyarakat/ Perpustakaan Desa;;;;;;;;Kemendibudristek, Kemendagri, Kemendesa PDTT, Perpustakaan nasional, Bakti-Kominfo, Badan pengembangan dan Pembinaan Bahasa;Dinas perpustakaan dan Kearsipan, Dinas Dikbud, Diskominfo;Dinas perpustakaan dan Kearsipan, Dinas Dikbud, Diskominfo, Dinas PMD;Pemdes, Karang Taruna, RT, RW, Kader Literasi Desa;Swasta, LSM, Akademisi, Pusat Studi Literasi, Mahasiswa
2;SOSIAL;SUB-DIMENSI FASILITAS MASYARAKAT;Taman Bacaan Masyarakat/ Perpustakaan Desa;Operasional Taman Bacaan Masyarakat/ Perpustakaan Desa;;;;;;;;Kemendikbudristek, Kemendagri, Kemendesa PDTT, Perpusnas, Bakti-Kominfo, Badan pengembangan dan pembinaan bahasa;Dinas perpustakaan dan Kearsipan, Dinas Dikbud, Diskominfo;Dinas perpustakaan dan Kearsipan, Dinas Dikbud, Diskominfo, Dinas PMD;Pemdes, Karang Taruna, RT, RW, Kader Literasi Desa;Swasta, LSM, Akademisi, Pusat Studi Literasi, Mahasiswa
2;SOSIAL;SUB-DIMENSI FASILITAS MASYARAKAT;Fasilitas Olahraga;Ketersediaan Fasilitas dan kondisi/keadaan sebagian besar Fasilitas olahraga di Desa;;;;;;;;Kemenpora, Kemendesa PDTT, KONI, Lembaga Pengelola Dana Hibah, ;Dispora, Dinas PU, Dinas Kesehatan;Dispora, Dinas PUPR, Dinas Kesehatan, Dinas Pariwisata;Pemdes, Karang Taruna, kelompok Pemuda, BPD;Swasta, Akademisi, Pusat Penelitian dan Pengembangan Olahraga
2;SOSIAL;SUB-DIMENSI FASILITAS MASYARAKAT;Keberadaan Ruang Publik Terbuka;Keberadaan ruang publik terbuka/keadaan sebagian besar Fasilitas Ruang Publik Terbuka di Desa;;;;;;;;KemenPUPR, Kemendesa PDTT, KLHK, Bappenas, Badan Pengelola Dana Lingkungan Hidup, LSM;Dinas PUPR, DLH,;Dinas PUPR, DLH,;Pemdes, BPD, ;Swasta, Akademisi, Badan Penelitian tata Kota dan Lingkungan
3;EKONOMI;SUB-DIMENSI PRODUKSI DESA;Keragaman Aktivitas Ekonomi;Keragaman Aktivitas Ekonomi di Desa;;;;;;;;Kemendesa PDTT, Kemenkop UKM, Kemendag, Kementan, Kemenparekraf, LPDB, BUMN, Lembaga Penelitian dan Pengembangan;Dinas Kop dan UMKM, Dinas Perindag;Dinas Koperasi dan UMKM, Dinas Perindag, Dinas Parekraf;Pemdes, BPD, Kelompok Tani, Nelayan dan Pengrajin Desa;Swasta, Koperasi, Bumdes, Akademisi, Pusat Penelitian Ekonomi dan Desa
3;EKONOMI;SUB-DIMENSI PRODUKSI DESA;Keragaman Aktivitas Ekonomi;Keaktifan Aktivitas Ekonomi di Desa;;;;;;;;Kemendesa PDTT, Kemenkop & UMKM, Kementan, Kemendag, BUMN, Lembaga Penelitian Ekonomi dan Kebijakan Publik, Lembaga Keuangan dan Bank BUMN;Dinas Kop dan UMKM, Dinas Perindag, Dinas Pariwisata;Dinas Koperasi dan UMKM, Dinas Pertanian, Dinas Pariwisata dan kebudayaan, Dinas Tenaga Kerja;Pemdes, BPD, Kelompok Tani, Pengrajin Desa, ;Swasta, Akademisi, Pusat Penelitian Ekonomi dan Sosial
3;EKONOMI;SUB-DIMENSI PRODUKSI DESA;Produk Unggulan Desa;Keberadaan Produk Unggulan Desa;;;;;;;;Kemendesa PDTT, Kementan, Kemenperin, Kemenkop UKM, Kemenparekraf, Kemendag, BPS, BUMN, LIPI, Brin;Dinas pMD, Disperindag, Dinas Pertanian dan Ketahanan Pangan, Dinas pariwisata dan Kebudayaan;Dinas pMD, Disperindag, Dinas Pertanian dan Ketahanan Pangan, Dinas pariwisata dan Kebudayaan;Pemdes, Bumdes, ;Akademisi, Pusat Penelitian dan Inovasi Universitas
3;EKONOMI;SUB-DIMENSI PRODUKSI DESA;Produk Unggulan Desa;Cakupan Penjualan Hasil Produk Unggulan Desa;;;;;;;;Kemendesa PDTT, Kementan, Kemenperin, Kemendag, BPS, BKPM;Dinas Koperasi dan UMKM, Dinas Perdagangan, Dinas Pertanian;Dinas pMD, Disperindag;Pemdes, Bumdes, Kelompok Tani, Kelompok Usaha;Swasta, Akademisi
3;EKONOMI;SUB-DIMENSI PRODUKSI DESA;Produk Unggulan Desa;Ketersediaan merek dagang;;;;;;;;Kemenkumham, Kemendesa PDTT, Kemendag, Kemenperin, BSN, Lembaga Pengkajian dan Pengembangan;Disperindag, Dinas Koperasi dan UKM;Disperindag, Dinas PMD;Pemdes, Bumdes, ;Swasta, Akademisi
3;EKONOMI;SUB-DIMENSI PRODUKSI DESA;Ekonomi Kreatif;Keberadaan Kearifan lokal atau kebudayaan lokal yang di jadikan sebagai kegiatan ekonomi dalam menunjang penghidupan masyarakat di desa;;;;;;;;Kemenparekraf, Kemendikbudristek, Kemendesa PDTT, Kemendag, Bekraf, Lembaga Kebudayaan Lokal;Dinas Pariwisata dan Kebudayaan, Dinas Koperasi daan UKM, Dinas Pendidikan;Dinas Pariwisata dan Kebudayaan, Dinas PMD, Dinas Perindustrian dan Perdagangan;Pemdes, Bumdes, Kelompok Masyarakat Adat dan Budaya;Swasta, Akademisi
3;EKONOMI;SUB-DIMENSI PRODUKSI DESA;Kerjasama Desa;Kerjasama desa dengan desa lainnya;;;;;;;;Kemendesa PDTT,Kemendagri, Kemenko PMK,BKPM, LPM;Dinas PMD, Dinas Perdagangan, Dinas Koperasi dan UKM;Dinas PMD, Disperindag, Dinas Pariwisata dan Kebudayaan;Pemdes, Bumdes, Kelompok Masyarakat;Swasta, Akademisi
3;EKONOMI;SUB-DIMENSI PRODUKSI DESA;Kerjasama Desa;Kerjasama desa dengan pihak ketiga;;;;;;;;Kemendesa PDTT,Kemendagri, Kemenko PMK,BKPM, LPM;Dinas PMD, Dinas Perdagangan, Dinas Koperasi dan UKM;Dinas PMD, Disperindag, Dinas Pariwisata dan Kebudayaan;Pemdes, Bumdes, Kelompok Masyarakat;Swasta, Akademisi
3;EKONOMI;SUB-DIMENSI FASILTAS PENDUKUNG EKONOMI;Akses Terhadap Pendidikan Non-formal/Pusat Keterampilan/Kursus;Ketersediaan Pendidikan Non-formal/Pusat Keterampilan/Kursus;;;;;;;;Kemendikbudristek, Kemenaker, Kemendesa PDTT,Kemensos, BNSP, Perpustakaan Nasional, LPKS;Dinas Pendidikan, Dinas Ketenagakerjaan, Disperindag;Dinas Pendidikan, Dinas Ketenagakerjaan, Dinas Koperasi dan UKM;Pemdes, Bumdes, Kelompok Masyarakat;Swasta, Akademisi
3;EKONOMI;SUB-DIMENSI FASILTAS PENDUKUNG EKONOMI;Akses Terhadap Pendidikan Non-formal/Pusat Keterampilan/Kursus;Keterlibatan Angkatan Kerja pada Pendidikan Non-formal/Pusat Keterampilan/Kursus;;;;;;;;Kemenaker, Kemendikbudristek, Kemendesa PDTT, Kemenperin, BNSP, Bappenas, BUMN;Dinas Ketenagakerjaan, Dinas Pendidikan, Disperindag;Dinas Ketenagakerjaan, Dinas Pendidikan, Dinas Koperasi dan UKM;Pemdes, Bumdes, Kelompok Pemuda Desa;Swasta, Akademisi
3;EKONOMI;SUB-DIMENSI FASILTAS PENDUKUNG EKONOMI;Pasar Rakyat;Ketersediaan Pasar di Desa;;;;;;;;Kemendesa PDTT, Kemendag, Kementerian Koperasi dan UKM, Kementan, LPDB-KUMKM, BKPM, Perpustakaan Nasional dan Lembaga Arsip Daerah;Disperindag, Dinas Koperasi dan UKM, Dinas Pertanian;Dinas Perdagangan, Dinas Koperasi dana UKM, Dinas Pertanian dan Perikanan;Pemdes, Bumdes, Kelompok Tani dan Pengrajin;Swasta, Akademisi
3;EKONOMI;SUB-DIMENSI FASILTAS PENDUKUNG EKONOMI;Pasar Rakyat;Kemudahan akses menuju pasar di Desa;;;;;;;;Kementerian PUPR, Kemenhub, Kemendesa PDTT, Kementan, BPIW, BNPB, LKPP;Dinas PUPR, Dinas Perhubungan, Dinas Pembangunan;Dinas PUPR, Dinas Perhubungan, Dinas PMD;Pemdes, Bumdes, Kelompok Masyarakat;Swasta, Akademisi
3;EKONOMI;SUB-DIMENSI FASILTAS PENDUKUNG EKONOMI;Toko/Pertokoan;Ketersediaan Toko/Pertokoan  di Desa;;;;;;;;Kemendesa PDTT, Kementerian Koperasi dan UKM, Kementerian PUPR, Kemendag, LPDB-KUMKM, BPIW, BKPM;Dinas Koperasi dan UKM, Disperindag, Dinas PU dan Penataan Ruang;Disperindag, Dinas Koperasi dan UKM, Dinas PU;Pemdes, Bumdes, Kelompok Masyarakat;Swasta, Akademisi
3;EKONOMI;SUB-DIMENSI FASILTAS PENDUKUNG EKONOMI;Toko/Pertokoan;Kemudahan akses menuju toko/pertokoan di Desa;;;;;;;;Kemendesa PDTT, Kementerian PUPR, Kemenhub, Kemendag, BPIW, BNPB, LPDB-KUMKM;Dinas PUPR, Dishub, Disperindag;Dinas PU, Dishub, Disperindag;Pemdes, Bumdes, Kelompok Masyarakat;Swasta, Akademisi
3;EKONOMI;SUB-DIMENSI FASILTAS PENDUKUNG EKONOMI;Kedai/Rumah Makan;Ketersediaan Kedai/Rumah Makan di Desa;;;;;;;;Kemendesa PDTT, Kemenparekraf, Kementerian Koperasi dan UKM, Kemendag, LPDB-KUMKM, Bekraf, BKPM;Dinas Koperasi dan UKM, Disperindag, Dinas Pariwisata;Dinas Koperasi dan UKM, Disperindag, Dinas Pariwisata;Pemdes, Bumdes, Kelompok Masyarakat;Swasta, Akademisi
3;EKONOMI;SUB-DIMENSI FASILTAS PENDUKUNG EKONOMI;Kedai/Rumah Makan;Kemudahan akses menuju Kedai/Rumah Makan di Desa;;;;;;;;Kemendesa PDTT, Kementerian PUPR, kemenhub, Kemenparekraf, BPIW, Bekraf, LPDB-KUMKM;Dias PUPR, Dishub, Dinas Pariwisata;Dinas PU, Dishub, Dinas Pariwisata;Pemdes, Bumdes, Kelompok Masyarakat;Swasta, Akademisi
3;EKONOMI;SUB-DIMENSI FASILTAS PENDUKUNG EKONOMI;Penginapan;Ketersediaan Penginapan di Desa;;;;;;;;Kemendesa PDTT, Kemenparekraf, Kementerian Koperasi dan UKM, Kemendag, Bekraf, BPIW, LPDB-KUMKM;Dinas Pariwisata, Dinas PUPR, Dinas Perdagangan dan Koperasi;Dinas Pariwisata, Dinas PU, Dinas Perdagangan dan Koperasi;Pemdes, Bumdes, Kelompok Masyarakat;Swasta, Akademisi
3;EKONOMI;SUB-DIMENSI FASILTAS PENDUKUNG EKONOMI;Penginapan;Kemudahan akses menuju Penginapan di Desa;;;;;;;;Kemendesa PDTT, Kementerian PUPR, Kemenhub, Kemenparekraf, BPIW-Bekraf, LPDB-KUMKM;Dinas PUPR, Dishub, Dinas Pariwisata;Dinas PU, Dishub, Dinas Pariwisata;Pemdes, Bumdes, Kelompok Masyarakat;Swasta, Akademisi
3;EKONOMI;SUB-DIMENSI FASILTAS PENDUKUNG EKONOMI;Layanan Pos dan Logistik;Ketersediaan Layanan Pos dan Logistik di Desa;;;;;;;;Kemendesa PDTT, Kementerian Kominfo, Kemenhub, BUMN, PT Pos Indonesia, Bulog, BPOM;Dishub, Diskominfo, Dinas Koperasi dan UKM;Dishub, Diskominfo, Dinas Koeprasi dan UKM;Pemdes, Bumdes, Kelompok Masyarakat;Swasta, Akademisi
3;EKONOMI;SUB-DIMENSI FASILTAS PENDUKUNG EKONOMI;Layanan Pos dan Logistik;Kemudahan akses menuju Layanan Pos dan Logistik di Desa;;;;;;;;Kemendesa PDTT, Kementerian Kominfo, Kemenhub, BUMN, PT Pos Indonesia, Bulog, BPOM;Dishub, Diskominfo, Dinas Perdagangan;Dishub, Dinas Komunikasi dan Informatika, Dinas Koperasi dan UKM;Pemdes, Bumdes, Kelompok Masyarakat;Swasta, Akademisi
3;EKONOMI;SUB-DIMENSI FASILTAS PENDUKUNG EKONOMI;Lembaga Ekonomi;Keberadaan BUM Desa/BUM Desa Bersama di Desa;;;;;;;;Kemendesa PDTT, Kementerian Koperasi dan UKM, Kemenkeu, Kementerian BUMN, BUMN, Lembaga Pengembangan Ekonomi,Bappenas;Dinas PMD, Dinas Koperasi dan UKM, Dinas Perdagangan;Dinas PMD,Dinas Koperasi dan UKM, Dinas Perdagangan;Pemdes, Bumdes;Swasta, Akademisi
3;EKONOMI;SUB-DIMENSI FASILTAS PENDUKUNG EKONOMI;Lembaga Ekonomi;BUM Desa/BUM Desa Bersama sudah berbadan hukum;;;;;;;;Kemendesa PDTT, Kemenkumham, Kementerian Koperasi dan UKM, BKPM, LPED;Dinas PMD, Dinas Koperasi dan UKM, Dinas Perdagangan;Dinas PMD,Dinas Koperasi dan UKM, Dinas Perdagangan;Pemdes, Bumdes;Swasta, Akademisi
3;EKONOMI;SUB-DIMENSI FASILTAS PENDUKUNG EKONOMI;Lembaga Ekonomi;Operasional BUM Desa/BUM Desa Bersama;;;;;;;;Kemendesa PDTT, Kementeian Koperasi dan UKM, Kemenkeu, BKPM, LPED;Dinas PMD, Dinas Koperasi dan UKM, Dinas Perdagangan;Dinas PMD,Dinas Koperasi dan UKM, Dinas Perdagangan;Pemdes, Bumdes;Swasta, Akademisi
3;EKONOMI;SUB-DIMENSI FASILTAS PENDUKUNG EKONOMI;Lembaga Ekonomi;Ketersediaan Lembaga Ekonomi lainnya di Desa (selain BUM Desa/BUM Desa bersama);;;;;;;;Kemendesa PDTT, Kementerian Koperasi dan UKM, Kemenkeu, Kemensos, BKPM, LPED, OJK;Dinas PMD, Dinas Koperasi dan UKM, Dinas Perdagangan;Dinas PMD,Dinas Koperasi dan UKM, Dinas Perdagangan;Pemdes;Swasta, Akademisi
3;EKONOMI;SUB-DIMENSI FASILTAS PENDUKUNG EKONOMI;Lembaga Ekonomi;Ketersediaan Lembaga Ekonomi KUD;;;;;;;;Kemendesa PDTT, Kementerian Koperasi dan UKM, Kemenkeu, Kemensos, BKPM, LPED, OJK;Dinas PMD, Dinas Koperasi dan UKM, Dinas Perdagangan;Dinas PMD,Dinas Koperasi dan UKM, Dinas Perdagangan;Pemdes, Lembaga Ekonomi;Swasta, Akademisi
3;EKONOMI;SUB-DIMENSI FASILTAS PENDUKUNG EKONOMI;Lembaga Ekonomi;Ketersediaan Lembaga Ekonomi UMKM;;;;;;;;Kemenkop UKM, Kemendesa PDTT, Kemendag, kemenkeu, Bekraf, BKPM, OJK, Lembaga Pembiayaan;Dinas Koperasi dan UKM, Dinas Perdagangan, Dinas Perindustrian;Dinas Koperasi dan UKM, Dinas Perdagangan, Dinas Perindustrian;Pemdes, Lembaga Ekonomi;Swasta, Akademisi
3;EKONOMI;SUB-DIMENSI FASILTAS PENDUKUNG EKONOMI;Layanan Keuangan;Ketersediaan layanan perbankan di desa;;;;;;;;Kemenkeu, BI, OJK, Kemendesa PDTT, BKPM, LKM;Dinas Koperasi dan UKM, Dinas Perdagangan;Dinas Koperasi dan UKM, Dinsos;Pemdes, Lembaga Ekonomi;Swasta, Akademisi
3;EKONOMI;SUB-DIMENSI FASILTAS PENDUKUNG EKONOMI;Layanan Keuangan;Operasional layanan perbankan;;;;;;;;Kemenkeu, BI, OJK, Kemendesa PDTT, BKPM, LKM;Dinas Koperasi dan UKM, Dinas Perdagangan;Dinas Koperasi dan UKM, Dinsos;Pemdes, Lembaga Ekonomi;Swasta, Akademisi
3;EKONOMI;SUB-DIMENSI FASILTAS PENDUKUNG EKONOMI;Layanan Keuangan;Keberadaan Layanan Fasilitas Kredit Berupa KUR;;;;;;;;Kemenkeu, Kemenkop UKM, Kemendesa PDTT, OJK, Bank Pemerintah, Lembaga Keuangan Mikro, Aosiasi Perbankan Indonesia;Dinas Koperasi dan UKM, Disperindag;Dinas Koperasi dan UKM, Dinas PMD;Pemdes, Lembaga Ekonomi, lembaga Pengelola Keuangan Desa;Swasta, Akademisi
3;EKONOMI;SUB-DIMENSI FASILTAS PENDUKUNG EKONOMI;Layanan Keuangan;Keberadaan Layanan Fasilitas Kredit Berupa KKP-E ;;;;;;;;Kemenkop UKM, Kemenkeu, OJK, Kemendesa PDTT, Bank Pemerintah, Lembaga Keuangan Mikro;Dinas Koperasi dan UKM, Disperindag;Dinas Koperasi dan UKM, Dinas PMD;Pemdes, Lembaga Ekonomi, lembaga Pengelola Keuangan Desa;Swasta, Akademisi
3;EKONOMI;SUB-DIMENSI FASILTAS PENDUKUNG EKONOMI;Layanan Keuangan;Keberadaan Layanan Fasilitas Kredit Berupa KUK ;;;;;;;;Kemenkop UKM, Kemenkeu, OJK, Kemendesa PDTT, Bank Pemeintah, Lembaga Keuangan Mikro;Dinas Koperasi dan UKM, Disperindag;Dinas Koperasi dan UKM, Dinas PMD;Pemdes, Lembaga Ekonomi Desa;Swasta, Akademisi
3;EKONOMI;SUB-DIMENSI FASILTAS PENDUKUNG EKONOMI;Layanan Keuangan;Status Layanan Fasilitas Kredit di Desa;;;;;;;;Kemenkeu, Kemenkop UKM, OJK, Bank Pemerintah, Lembaga Keuangan Mikro,lembaga Pembiayaan;Dinas Koperasi dan UKM, Disperindag;Dinas Koperasi dan UKM, Dinas PMD;Pemdes, Lembaga Ekonomi Desa;Swasta, Akademisi
4;LINGKUNGAN;SUB-DIMENSI PENGELOLAAN LINGKUNGAN;Kearifan Lingkungan;Terdapat upaya menjaga/mempertahankan/melestarikan kearifan lingkungan berupa atraksi alam/sumberdaya alam/keindahan alam yang ada di desa;;;;;;;;"KLHK, Kemenparekraf, Kemendesa PDTT, Bappenas";"Dinas Lingkungan Hidup Provinsi, Dinas Pariwisata Provinsi, Bappeda Provinsi";"Dinas Lingkungan Hidup Kab/Kota, Dinas Pariwisata Kab/Kota";"Pemerintah Desa, Pokdarwis";"LSM, Swasta, BUMDes, Akademisi"
